<?xml version="1.0" encoding="UTF-8"?>
<PMML version="3.0" xmlns="http://www.dmg.org/PMML-3-0" xmlns:xsi="http://www.w3.org/2001/XMLSchema_instance" xsi:noNamespaceSchemaLocation="Dialog.xsd" >
  <WndForm Name="frmAirspaceSelect" Type="Dialog" X="0" Y="0" Width="240" Height="320" Caption="_@M591_" Font="2" >

    <WndButton Name="cmdSelect" Caption="_@M595_" X="4" Y="2" Width="114"  Height="28" Font="2" Tag="3" />
    <WndButton Name="cmdClose" Caption="_@M186_" X="118" Y="2" Width="114"  Height="28" Font="2" Tag="3" />
    
	<WndFrame X="20" Y="33" Width="80" Height="18" Font="2" Caption="_@M287_" />
    <WndButton Name="cmdName" Caption="*" X="20" Y="48" Width="86"  Height="22" Font="2" />
	
    <WndProperty Name="prpFltType" Caption="_@M752_" X="118" Y="32"  Width="114" Height="40" CaptionWidth="0" Font="2" >
      <DataField Name="" DataType="string" DisplayFormat="%s" EditFormat="%s" OnDataAccess="OnFilterType"/>
    </WndProperty>
	
    <WndProperty Name="prpFltDistance"  Caption="_@M245_"  X="4" Y="74"  Width="114" Height="40" CaptionWidth="0" Font="2" >
      <DataField Name="" DataType="string" DisplayFormat="%s" EditFormat="%s" OnDataAccess="OnFilterDistance"/>
    </WndProperty>
    <WndProperty Name="prpFltDirection" Caption="_@M238_" X="118" Y="74"  Width="114" Height="40" CaptionWidth="0" Font="2" >
      <DataField Name="" DataType="string" DisplayFormat="%s" EditFormat="%s" OnDataAccess="OnFilterDirection"/>
    </WndProperty>
    <WndListFrame Name="frmAirspaceList" X="1" Y="116" Width="-1" Height="-1" Font="2" OnListInfo="OnWpListInfo">
      <WndOwnerDrawFrame Name="frmAirspaceListEntry" X="2" Y="2" Width="-2" Height="18" Font="2"  OnPaint="OnPaintListItem"/>
    </WndListFrame>
  </WndForm>
</PMML>
