<?xml version="1.0" encoding="UTF-8"?>
<PMML version="3.0" xmlns="http://www.dmg.org/PMML-3-0" xmlns:xsi="http://www.w3.org/2001/XMLSchema_instance" xsi:noNamespaceSchemaLocation="Dialog.xsd">
  <WndForm Name="frmConfiguration" Type="Dialog" X="0" Y="0" Width="240" Height="320" Caption="_@M195_" Font="2" >
    <WndButton Name="cmdClose" Caption="_@M186_" X="2" Y="270" Width="105"  Height="30" Font="2" OnClickNotify="OnCloseClicked" Tag="2" />
    <WndFrame Name="frmPilot" X="0" Y="0" Width="240" Height="269" Font="2">
      <WndProperty Caption="_@M525_" X="2" Y="-1" Width="-2" Height="44" Keyboard="1" Font="2" CaptionWidth="0">
        <DataField DataType="string" OnDataAccess="OnPilotName" />
      </WndProperty>
      <WndFrame  Caption="_@M2281_" X="2" Y="45" Width="52" Height="22" />

      <WndButton Name="cmdAdd" Caption="_@M459_" X="84" Y="45" Width="52" Height="22" Font="2" OnClickNotify="OnTrackingAddClicked" Tag="3" />
      <WndButton Name="cmdEdit" Caption="_@M252_" X="136" Y="45" Width="52" Height="22" Font="2" OnClickNotify="OnTrackingEditClicked" Tag="3" />
      <WndButton Name="cmdDelete" Caption="_@M230_" X="188" Y="45" Width="52" Height="22" Font="2" OnClickNotify="OnTrackingDeleteClicked" Tag="3" />

      <WndListFrame Name="lstTracking" X="2" Y="67" Width="-2" Height="-2" Font="2" OnListInfo="OnTrackingListInfo" >
        <WndOwnerDrawFrame Name="lstTrackingItem" X="2" Y="2" Width="-2" Height="18" Font="2" OnPaint="OnTrackingPaintListItem" />
      </WndListFrame>
    </WndFrame>
  </WndForm>
</PMML>
