<?xml version="1.0" encoding="UTF-8"?>
<PMML version="3.0" xmlns="http://www.dmg.org/PMML-3-0" xmlns:xsi="http://www.w3.org/2001/XMLSchema_instance" xsi:noNamespaceSchemaLocation="Dialog.xsd">
  <WndForm Name="frmSetCustommenu" Type="Dialog" X="0" Y="0" Width="240" Height="240" Caption="_@M1787_" Font="2" >
    <WndButton   Caption="_@M186_"    X="2" Y="2" Width="60"  Height="22" Font="2" OnClickNotify="OnCloseClicked" Tag="1"/>
    <WndProperty Name="prpCustomMenu1" Caption="1 " X="63" Y="-999" Width="177" Height="22" CaptionWidth="15" Font="2" Help="_@H1259_">
      <DataField Name="" DataType="enum" Min="0" Max="30" Step="1" />
    </WndProperty>
    <WndProperty Name="prpCustomMenu2" Caption="2 " X="63" Y="-1" Width="177" Height="22" CaptionWidth="15" Font="2" Help="_@H1259_">
      <DataField Name="" DataType="enum" Min="0" Max="30" Step="1" />
    </WndProperty>
    <WndButton  Caption="_@M560_" X="2" Y="-1" Width="60"  Height="22" Font="2" OnClickNotify="OnResetClicked" Tag="1"/>
    <WndProperty Name="prpCustomMenu3" Caption="3 " X="63" Y="-999" Width="177" Height="22" CaptionWidth="15" Font="2" Help="_@H1259_">
      <DataField Name="" DataType="enum" Min="0" Max="30" Step="1" />
    </WndProperty>
    <WndProperty Name="prpCustomMenu4" Caption="4 " X="63" Y="-1" Width="177" Height="22" CaptionWidth="15" Font="2" Help="_@H1259_">
      <DataField Name="" DataType="enum" Min="0" Max="30" Step="1" />
    </WndProperty>
    <WndProperty Name="prpCustomMenu5" Caption="5 " X="63" Y="-1" Width="177" Height="22" CaptionWidth="15" Font="2" Help="_@H1259_">
      <DataField Name="" DataType="enum" Min="0" Max="30" Step="1" />
    </WndProperty>
    <WndProperty Name="prpCustomMenu6" Caption="6 " X="63" Y="-1" Width="177" Height="22" CaptionWidth="15" Font="2" Help="_@H1259_">
      <DataField Name="" DataType="enum" Min="0" Max="30" Step="1" />
    </WndProperty>
    <WndProperty Name="prpCustomMenu7" Caption="7 " X="63" Y="-1" Width="177" Height="22" CaptionWidth="15" Font="2" Help="_@H1259_">
      <DataField Name="" DataType="enum" Min="0" Max="30" Step="1" />
    </WndProperty>
    <WndProperty Name="prpCustomMenu8" Caption="8 " X="63" Y="-1" Width="177" Height="22" CaptionWidth="15" Font="2" Help="_@H1259_">
      <DataField Name="" DataType="enum" Min="0" Max="30" Step="1" />
    </WndProperty>
    <WndProperty Name="prpCustomMenu9" Caption="9 " X="63" Y="-1" Width="177" Height="22" CaptionWidth="15" Font="2" Help="_@H1259_">
      <DataField Name="" DataType="enum" Min="0" Max="30" Step="1" />
    </WndProperty>
    <WndProperty Name="prpCustomMenu10" Caption="10 " X="63" Y="-1" Width="177" Height="22" CaptionWidth="15" Font="2" Help="_@H1259_">
      <DataField Name="" DataType="enum" Min="0" Max="30" Step="1" />
    </WndProperty>
  </WndForm>
</PMML>
