<?xml version="1.0" encoding="UTF-8"?>
<PMML version="3.0" xmlns="http://www.dmg.org/PMML-3-0" xmlns:xsi="http://www.w3.org/2001/XMLSchema_instance" xsi:noNamespaceSchemaLocation="Dialog.xsd">
  <WndForm Name="frmConfiguration" Type="Dialog" X="0" Y="0" Width="320" Height="240" Caption="_@M195_" Font="2" >
    <WndButton Name="cmdClose" Caption="_@M186_" X="3" Y="178" Width="62"  Height="42" Font="2" Tag="3" />
    <WndFrame Name="frmPilot" X="70" Y="10" Width="-246" Height="222" Font="2">
      <WndButton Name="cmdPilotName" Caption="_@M525_" X="2" Y="1" Width="-246"  Height="35" Font="2" />
      <WndProperty Name="prpLiveTrackerInterval" Caption="_@M1779_" X="2" Y="70" Width="236" Height="22" CaptionWidth="150" Font="2" Help="_@H1258_">
        <DataField Name="" DataType="double" DisplayFormat="%.0f %s" EditFormat="%.0f" Min="0.0" Max="60.0" Step="1.0" />
      </WndProperty>
      <WndButton Name="cmdLiveTrackersrv" Caption="_@M1782_" X="2" Y="-1" Width="200"  Height="25" Font="2" />
      <WndButton Name="cmdLiveTrackerport" Caption="Port" X="202" Y="-999" Width="35"  Height="25" Font="2" />
      <WndButton Name="cmdLiveTrackerusr" Caption="_@M1780_" X="2" Y="-1" Width="117"  Height="25" Font="2" />
      <WndButton Name="cmdLiveTrackerpwd" Caption="_@M1781_" X="120" Y="-999" Width="117"  Height="25" Font="2" />
    </WndFrame>
  </WndForm>
</PMML>
