<?xml version="1.0" encoding="UTF-8"?>
<PMML version="3.0" xmlns="http://www.dmg.org/PMML-3-0" xmlns:xsi="http://www.w3.org/2001/XMLSchema_instance" xsi:noNamespaceSchemaLocation="Dialog.xsd">
  <WndForm Name="frmConfiguration" Type="Dialog" X="0" Y="0" Width="240" Height="320" Caption="_@M195_" Font="2" >
    <WndButton Name="cmdClose" Caption="_@M186_" X="5" Y="270" Width="105"  Height="30" Font="2" Tag="2" />
    <WndFrame Name="frmPolar" X="0" Y="0" Width="235" Height="222" Font="2">
      <WndProperty Name="prpAircraftCategory" Caption="_@M164_" X="2" Y="-1" Width="235" Height="22" CaptionWidth="150" Font="2" Help="_@H1205_" >
        <DataField Name="" DataType="enum" Min="0" Max="10" Step="1"/>
      </WndProperty>
      <WndProperty Name="prpPolarFile" Caption="_@M751_" X="2" Y="-1" Width="235" Height="22" CaptionWidth="150" Font="2" Help="_@H1208_">
        <DataField Name="" DataType="filereader" Min="0" Max="200" Step="1" OnDataAccess="OnPolarFileData"/>
      </WndProperty>
      <WndProperty Name="prpMaxManoeuveringSpeed" Caption="_@M1744_" X="2" Y="-1" Width="235" Height="22" CaptionWidth="150" Font="2" Help="_@H150_" Keyboard="1">
        <DataField Name="" DataType="double" DisplayFormat="%.0f %s" EditFormat="%.0f" Min="30" Max="300" Step="1"/>
      </WndProperty>
      <WndProperty Name="prpHandicap" Caption="_@M334_" X="2" Y="-1" Width="235" Height="22" CaptionWidth="150" Font="2" Help="_@H151_" Keyboard="1">
        <DataField Name="" DataType="double" DisplayFormat="%.0f " EditFormat="%.0f" Min="50" Max="150" Step="1"/>
      </WndProperty>
      <WndProperty Name="prpBallastSecsToEmpty" Caption="_@M246_" X="2" Y="-1" Width="235" Height="22" CaptionWidth="150" Font="2" Help="_@H152_" Keyboard="1">
        <DataField Name="" DataType="double" DisplayFormat="%.0f s" EditFormat="%.0f" Min="10" Max="900" Step="1"/>
      </WndProperty>
      <WndButton Name="cmdAircraftType" Caption="_@M60_" X="2" Y="-1" Width="235"  Height="22" Font="2" />
      <WndButton Name="cmdAircraftRego" Caption="_@M56_" X="2" Y="-1" Width="235"  Height="22" Font="2" />
      <WndButton Name="cmdCompetitionClass" Caption="_@M937_" X="2" Y="-1" Width="235"  Height="22" Font="2" />
      <WndButton Name="cmdCompetitionID" Caption="_@M939_" X="2" Y="-1" Width="235"  Height="22" Font="2" />
    </WndFrame>
  </WndForm>
</PMML>
