<?xml version="1.0" encoding="UTF-8"?>
<PMML version="3.0" 
  xmlns="http://www.dmg.org/PMML-3-0" 
  xmlns:xsi="http://www.w3.org/2001/XMLSchema_instance" xsi:noNamespaceSchemaLocation="Dialog.xsd">
  <WndForm Name="frmConfiguration" Type="Dialog" X="0" Y="0" Width="320" Height="240" Caption="_@M195_" Font="2">
    <WndButton Name="cmdA" Caption="A" X="1" Y="-1" Width="50" Height="40" Font="2" Tag="2" OnClickNotify="OnA" />
    <WndButton Name="cmdB" Caption="B" X="51" Y="-999" Width="50" Height="40" Font="2" Tag="2" OnClickNotify="OnB" />
    <WndButton Name="cmdC" Caption="C" X="101" Y="-999" Width="50" Height="40" Font="2" Tag="2" OnClickNotify="OnC" />
    <WndButton Name="cmdD" Caption="D" X="151" Y="-999" Width="50" Height="40" Font="2" Tag="2" OnClickNotify="OnD" />
    <WndButton Name="cmdE" Caption="E" X="201" Y="-999" Width="50" Height="40" Font="2" Tag="2" OnClickNotify="OnE" />
    <WndButton Name="cmdF" Caption="F" X="251" Y="-999" Width="50" Height="40" Font="2" Tag="2" OnClickNotify="OnF" />

    <WndButton Name="cmdTerminal" Caption="_@M1871_" X="3" Y="138" Width="70" Height="28" Font="2" Tag="3" OnClickNotify="OnTerminalClicked" />
    <WndButton Name="cmdClose" Caption="_@M186_" X="3" Y="194" Width="70" Height="28" Font="2" Tag="3" OnClickNotify="OnCloseClicked" />

    <WndFrame Name="frmCommName" Caption="_@M232_" X="0" Y="40" Width="-1" Height="98" Font="2">
      <WndButton Name="cmdConfigDev" Caption="_@M2414_" X="3" Y="20" Width="50" Height="28" Font="2" Tag="3" OnClickNotify="OnConfigDevClicked" />

      <WndProperty Name="prpComDevice1" Caption="_@M450_" X="60" Y="1" Width="-1" Height="22" CaptionWidth="70" Font="2" Help="_@H153_">
        <DataField Name="" DataType="enum" OnDataAccess="OnDeviceAData" />
      </WndProperty>
      <WndProperty Name="prpComPort1" Caption="_@M530_" X="60" Y="-1" Width="195" Height="22" CaptionWidth="70" Font="2" Help="_@H154_">
        <DataField Name="" DataType="enum" Min="0" Max="50" Step="1" OnDataAccess="OnComPort1Data"/>
      </WndProperty>
      <WndProperty Name="prpExtSound1" Caption="_@M2250_" X="235" Y="-999" Width="-1" Height="22" CaptionWidth="70" Font="2" Help="_@H240_">
        <DataField Name="" DataType="boolean"/>
      </WndProperty>
      <WndButton Name="cmdReplay" Caption="_@M285_" X="130" Y="45" Width="105" Height="22" Font="2" Tag="3" OnClickNotify="OnConfigDevReplayClicked" />
      <WndProperty Name="prpComSpeed1" Caption="_@M135_" X="60" Y="45" Width="155" Height="22" CaptionWidth="70" Font="2" Help="_@H155_">
        <DataField Name="" DataType="enum" Min="0" Max="50" Step="1" />
      </WndProperty>
      <WndProperty Name="prpComBit1" Caption=" " X="215" Y="-999" Width="-1" Height="22" CaptionWidth="1" Font="2" Help="_@H156_">
        <DataField Name="" DataType="enum" Min="0" Max="50" Step="1" />
      </WndProperty>
      <WndProperty Name="prpComIpAddr1" Caption="IP" X="60" Y="-999" Width="240" Height="22" CaptionWidth="70" Font="2" Keyboard="1">
        <DataField Name="" DataType="string" DisplayFormat="%s" EditFormat="%s"/>
      </WndProperty>
      <WndProperty Name="prpComIpPort1" Caption="Port" X="250" Y="-999" Width="-1" Height="22" CaptionWidth="30" Font="2" Keyboard="1">
        <DataField Name="" DataType="integer" DisplayFormat="%d" EditFormat="%d" Min="1" Max="65635" Step="1"/>
      </WndProperty>
      <WndProperty Name="prpStatus" Caption="_@M660_" X="60" Y="70" Width="-1" Height="22" CaptionWidth="70" Font="2" ReadOnly="1" Keyboard="0">
        <DataField Name="" DataType="string" DisplayFormat="%s" EditFormat="%s"/>
      </WndProperty>
    </WndFrame>

    <WndProperty Name="prpUseGeoidSeparation" Caption="_@M322_" X="75" Y="140" Width="-1" Height="21" CaptionWidth="115" Font="2" Help="_@H158_">
      <DataField Name="" DataType="boolean"/>
    </WndProperty>
    <WndProperty Name="prpPollingMode" Caption="_@M596_" X="75" Y="-1" Width="-1" Height="21" CaptionWidth="115" Font="2" Help="_@H160_">
      <DataField Name="" DataType="enum" Min="0" Max="1" Step="1"/>
    </WndProperty>
    <WndProperty Name="prpAppInfoBoxModel" Caption="_@M234_" X="75" Y="-1" Width="-1" Height="21" CaptionWidth="115" Font="2" Help="_@H209_">
      <DataField Name="" DataType="enum" Min="0" Max="50" Step="1"/>
    </WndProperty>
  </WndForm>
</PMML>
