<?xml version="1.0" encoding="UTF-8"?>
<PMML version="3.0" xmlns="http://www.dmg.org/PMML-3-0" xmlns:xsi="http://www.w3.org/2001/XMLSchema_instance" xsi:noNamespaceSchemaLocation="Dialog.xsd" >
  <WndForm Name="frmAirspaceFiles" Type="Dialog" X="0" Y="0" Width="320" Height="240" Caption="?" Font="2"  >
    <WndFrame X="0" Y="0" Width="100" Height="20" Font="2" />
    <WndButton   Name="cmdClose" Caption="_@M186_"    X="2" Y="2" Width="98"  Height="22" Font="2" OnClickNotify="OnCloseClicked"/>
      <WndProperty Name="prpFile1" Caption="1" X="2" Y="-1" Width="-1" Height="22" CaptionWidth="15" Font="2" Help="_@H105_">
        <DataField Name="" DataType="filereader" Min="0" Max="200" Step="1"/>
      </WndProperty>
      <WndProperty Name="prpFile2" Caption="2" X="2" Y="-1" Width="-1" Height="22" CaptionWidth="15" Font="2" Help="_@H105_">
        <DataField Name="" DataType="filereader" Min="0" Max="200" Step="1"/>
      </WndProperty>
      <WndProperty Name="prpFile3" Caption="3" X="2" Y="-1" Width="-1" Height="22" CaptionWidth="15" Font="2" Help="_@H105_">
        <DataField Name="" DataType="filereader" Min="0" Max="200" Step="1"/>
      </WndProperty>
      <WndProperty Name="prpFile4" Caption="4" X="2" Y="-1" Width="-1" Height="22" CaptionWidth="15" Font="2" Help="_@H105_">
        <DataField Name="" DataType="filereader" Min="0" Max="200" Step="1"/>
      </WndProperty>
      <WndProperty Name="prpFile5" Caption="5" X="2" Y="-1" Width="-1" Height="22" CaptionWidth="15" Font="2" Help="_@H105_">
        <DataField Name="" DataType="filereader" Min="0" Max="200" Step="1"/>
      </WndProperty>
      <WndProperty Name="prpFile6" Caption="6" X="2" Y="-1" Width="-1" Height="22" CaptionWidth="15" Font="2" Help="_@H105_">
        <DataField Name="" DataType="filereader" Min="0" Max="200" Step="1"/>
      </WndProperty>
      <WndProperty Name="prpFile7" Caption="7" X="2" Y="-1" Width="-1" Height="22" CaptionWidth="15" Font="2" Help="_@H105_">
        <DataField Name="" DataType="filereader" Min="0" Max="200" Step="1"/>
      </WndProperty>
      <WndProperty Name="prpFile8" Caption="8" X="2" Y="-1" Width="-1" Height="22" CaptionWidth="15" Font="2" Help="_@H105_">
        <DataField Name="" DataType="filereader" Min="0" Max="200" Step="1"/>
      </WndProperty>
      <WndProperty Name="prpFile9" Caption="9" X="2" Y="-1" Width="-1" Height="22" CaptionWidth="15" Font="2" Help="_@H105_">
        <DataField Name="" DataType="filereader" Min="0" Max="200" Step="1"/>
      </WndProperty>
  </WndForm>
</PMML>
