<?xml version="1.0" encoding="UTF-8"?>
<PMML version="3.0" xmlns="http://www.dmg.org/PMML-3-0" xmlns:xsi="http://www.w3.org/2001/XMLSchema_instance" xsi:noNamespaceSchemaLocation="Dialog.xsd" >
  <WndForm Name="frmWayPointInfo" Type="Dialog" X="0" Y="0" Width="320" Height="240" Caption="_@M796_" Font="2" >
    <WndButton Name="cmdNext"  Caption="_@M460_" X="3" Y="4"   Width="65"  Height="70" Font="2" Tag="1" OnClickNotify="OnNextClicked"/>
    <WndButton Name="cmdPrev"  Caption="_@M6_"   X="3" Y="78"  Width="65"  Height="70" Font="2" Tag="0" OnClickNotify="OnPrevClicked"/>
    <WndButton Name="cmdClose" Caption="_@M186_" X="3" Y="152" Width="65"  Height="70" Font="2" Tag="3" OnClickNotify="OnCloseClicked"/>
    <WndFrame Name="frmInfos"       X="70" Y="1" Width="-1" Height="-1" Font="2">
      <WndProperty Name="prpCoordinate"  Caption="_@M918_" X="2" Y="2" Width="-1" Height="22" CaptionWidth="60" Font="2" ReadOnly="1" />
      <WndProperty Name="prpAltitude"  Caption="_@M255_" X="2" Y="-1" Width="-1" Height="22" CaptionWidth="150" Font="2" ReadOnly="1" />
      <WndProperty Name="prpSunset"    Caption="_@M671_" X="2" Y="-1" Width="-1" Height="22" CaptionWidth="150" Font="2" ReadOnly="1" />
      <WndProperty Name="prpDistance"  Caption="_@M245_" X="2" Y="-1" Width="-1" Height="22" CaptionWidth="150" Font="2" ReadOnly="1" />
      <WndProperty Name="prpBearing"   Caption="_@M138_" X="2" Y="-1" Width="-1" Height="22" CaptionWidth="150" Font="2" ReadOnly="1" />
      <WndProperty Name="prpMc0"       Caption="_@M83_" X="2" Y="-1" Width="-1" Height="22" CaptionWidth="150" Font="2" ReadOnly="1" />
      <WndProperty Name="prpMc2"       Caption="_@M84_" X="2" Y="-1" Width="-1" Height="22" CaptionWidth="150" Font="2" ReadOnly="1" />
      <WndListFrame Name="frmWpComment" X="2" Y="-1" Width="-1" Height="64" Font="2" OnListInfo="OnWpCommentListInfo">
        <WndOwnerDrawFrame Name="frmWpCommentEntry" X="2" Y="-1" Width="-1" Height="18" Font="2"  OnPaint="OnPaintWpCommentListItem" />
      </WndListFrame>
      <WndOwnerDrawFrame Name="frmWaypointPicto"     X="10" Y="50" Width="50" Height="50" Font="2"  OnPaint="OnPaintWaypointPicto"/>  	  
    </WndFrame>
    <WndListFrame Name="frmDetails" X="70" Y="1" Width="-1" Height="-1" Font="3"    OnListInfo="OnDetailsListInfo">
      <WndOwnerDrawFrame Name="frmDetailsEntry" X="2" Y="2" Width="-2" Height="18" Font="3"  OnPaint="OnPaintDetailsListItem"/>
    </WndListFrame>
    <WndFrame Name="frmPictures"    X="70" Y="1" Width="-1" Height="-1" Font="2">
        <WndOwnerDrawFrame Name="frmPicture" X="1" Y="0" Width="-1" Height="-1" Font="2"  OnPaint="OnPaintPicture"/>
    </WndFrame>
    <WndFrame Name="frmCommands"    X="70" Y="1" Width="-1" Height="-1" Font="2" Visible="0">
      <WndButton Name="cmdInserInTask" Caption="dynamic" X="4" Y="2" Width="-2"  Height="44" Font="2" OnClickNotify="OnInserInTaskClicked"/>
      <WndButton Name="cmdAppendInTask1" Caption="_@M1827_" X="4" Y="-1" Width="-2" Height="44" Font="2" OnClickNotify="OnAppendInTask1Clicked"/>
      <WndButton Name="cmdAppendInTask2" Caption="_@M1828_" X="4" Y="-1" Width="-2" Height="44" Font="2" OnClickNotify="OnAppendInTask2Clicked"/>
      <WndButton Name="cmdRemoveFromTask" Caption="_@M552_" X="4" Y="-1" Width="-2" Height="44" Font="2" OnClickNotify="OnRemoveFromTaskClicked"/>
      <WndButton Name="cmdReplace" Caption="dynamic" X="4" Y="-1" Width="-2"  Height="41" Font="2" OnClickNotify="OnReplaceClicked"/>
    </WndFrame>
    <WndFrame Name="frmSpecial"     X="70" Y="1" Width="-1" Height="-1" Font="2" Visible="0">
      <WndButton Name="cmdNewHome" Caption="_@M605_" X="4" Y="4" Width="-2" Height="51" Font="2" OnClickNotify="OnNewHomeClicked"/>
      <WndButton Name="cmdTeamCode" Caption="_@M604_" X="4" Y="-997" Width="-2" Height="51" Font="2" OnClickNotify="OnTeamCodeClicked"/>
    </WndFrame>
  </WndForm>
</PMML>
