<?xml version="1.0" encoding="UTF-8"?>
<PMML version="3.0" xmlns="http://www.dmg.org/PMML-3-0" xmlns:xsi="http://www.w3.org/2001/XMLSchema_instance" xsi:noNamespaceSchemaLocation="Dialog.xsd">
  <WndForm Name="frmFlySim" Type="Dialog" X="0" Y="0" Width="320" Height="240" Font="2" BackColor="0" Caption="" >
    <WndOwnerDrawFrame Name="frmSplash" X="0" Y="2" Width="318" Height="210" Font="0" OnPaint="OnSplashPaint" />
    <WndButton Name="cmdNULL" Caption="" X="1" Y="205" Width="0"  Height="0" Font="2" Tag="3" />
    <WndButton Name="cmdFLY" Caption="_@M281_" X="1" Y="205" Width="90"  Height="30" Font="2" Tag="3" />
    <WndButton Name="cmdDUALPROFILE" Caption="_@M516_" X="93" Y="205" Width="73"  Height="30" Font="2" Tag="3" />
    <WndButton Name="cmdEXIT" Caption="_@M248_" X="166" Y="205" Width="60"  Height="30" Font="2" Tag="3" />
    <WndButton Name="cmdSIM" Caption="_@M570_" X="228" Y="205" Width="90"  Height="30" Font="2" Tag="3" />
  </WndForm>
</PMML>
