<?xml version="1.0" encoding="UTF-8"?>
<PMML version="3.0" xmlns="http://www.dmg.org/PMML-3-0" xmlns:xsi="http://www.w3.org/2001/XMLSchema_instance" xsi:noNamespaceSchemaLocation="Dialog.xsd" >
  <WndForm Name="frmAirspace" Type="Dialog" X="0" Y="0" Width="320" Height="240" Caption="_@M68_" Font="2"  >
    <WndFrame X="0" Y="0" Width="100" Height="20" Font="2" />
    <WndButton   Name="cmdClose" Caption="_@M186_"    X="2" Y="2" Width="98"  Height="22" Font="2" OnClickNotify="OnCloseClicked"/>
    <WndButton   Name="cmdLookup" Caption="_@M411_"    X="2" Y="26" Width="98"  Height="22" Font="2" OnClickNotify="OnLookupClicked"/>
    <WndProperty Name="prpUsedOnly" Caption="Used only" X="2" Y="50" Width="98" Height="44" CaptionWidth="0" Font="2">
      <DataField Name="" DataType="boolean" OnDataAccess="OnFilterUsedOnly"/>
    </WndProperty>
    <WndListFrame Name="frmAirspaceList" X="102" Y="0" Width="-2" Height="222" Font="2" OnListInfo="OnAirspaceListInfo">
      <WndOwnerDrawFrame Name="frmAirspaceListEntry" X="2" Y="2" Width="-2" Height="18" Font="2"  OnPaint="OnAirspacePaintListItem"/>
    </WndListFrame>
  </WndForm>
</PMML>
